{
  "schema_version": "clozn.context-utilization.v1",
  "run_id": "run-fixture-4",
  "privacy": "metadata_only",
  "measurement": {
    "state": "unavailable",
    "reason": "no_text_context"
  },
  "sources": [],
  "summary": {
    "prompt_sources": 0,
    "measured_sources": 0,
    "sources_with_clear_measured_effect": 0,
    "sources_below_measured_floor": 0,
    "sources_not_measured": 0
  }
}
